{
  "sheet_type": "objects",
  "image": "house_tileset16x16.png",
  "tile_size": [
    16,
    16
  ],
  "objects": {
    "object_16": {
      "position": [
        4,
        2
      ],
      "size_tiles": [
        1,
        1
      ]
    },
    "object_10": {
      "position": [
        4,
        1
      ],
      "size_tiles": [
        1,
        1
      ]
    },
    "object_23": {
      "position": [
        5,
        3
      ],
      "size_tiles": [
        1,
        1
      ]
    },
    "object_19": {
      "position": [
        1,
        3
      ],
      "size_tiles": [
        1,
        1
      ]
    },
    "object_13": {
      "position": [
        1,
        2
      ],
      "size_tiles": [
        1,
        1
      ]
    },
    "object_14": {
      "position": [
        2,
        2
      ],
      "size_tiles": [
        1,
        1
      ]
    },
    "object_3": {
      "position": [
        3,
        0
      ],
      "size_tiles": [
        1,
        1
      ]
    },
    "object_20": {
      "position": [
        2,
        3
      ],
      "size_tiles": [
        1,
        1
      ]
    },
    "object_21": {
      "position": [
        3,
        3
      ],
      "size_tiles": [
        1,
        1
      ]
    },
    "object_7": {
      "position": [
        1,
        1
      ],
      "size_tiles": [
        1,
        1
      ]
    },
    "object_9": {
      "position": [
        3,
        1
      ],
      "size_tiles": [
        1,
        1
      ]
    },
    "object_8": {
      "position": [
        2,
        1
      ],
      "size_tiles": [
        1,
        1
      ]
    },
    "object_5": {
      "position": [
        5,
        0
      ],
      "size_tiles": [
        1,
        1
      ]
    },
    "object_6": {
      "position": [
        0,
        1
      ],
      "size_tiles": [
        1,
        1
      ]
    },
    "object_18": {
      "position": [
        0,
        3
      ],
      "size_tiles": [
        1,
        1
      ]
    },
    "object_11": {
      "position": [
        5,
        1
      ],
      "size_tiles": [
        1,
        1
      ]
    },
    "object_15": {
      "position": [
        3,
        2
      ],
      "size_tiles": [
        1,
        1
      ]
    },
    "object_0": {
      "position": [
        0,
        0
      ],
      "size_tiles": [
        1,
        1
      ]
    },
    "object_4": {
      "position": [
        4,
        0
      ],
      "size_tiles": [
        1,
        1
      ]
    },
    "object_22": {
      "position": [
        4,
        3
      ],
      "size_tiles": [
        1,
        1
      ]
    },
    "object_2": {
      "position": [
        2,
        0
      ],
      "size_tiles": [
        1,
        1
      ]
    },
    "object_1": {
      "position": [
        1,
        0
      ],
      "size_tiles": [
        1,
        1
      ]
    },
    "object_12": {
      "position": [
        0,
        2
      ],
      "size_tiles": [
        1,
        1
      ]
    },
    "object_17": {
      "position": [
        5,
        2
      ],
      "size_tiles": [
        1,
        1
      ]
    }
  }
}