{
  "sheet_type": "objects",
  "image": "House.png",
  "tile_size": [
    32,
    32
  ],
  "objects": {
    "object_1": {
      "position": [
        1,
        0
      ],
      "size_tiles": [
        1,
        1
      ]
    },
    "object_0": {
      "position": [
        0,
        0
      ],
      "size_tiles": [
        1,
        1
      ]
    }
  }
}